{
  "ok": true,
  "api_version": 1,
  "meta": {
    "realm": "TSW",
    "cached": true,
    "generated_at": "2026-10-08T17:57:33Z",
    "marker_warmed_at": "2026-10-08T17:57:32Z"
  },
  "build": {
    "name": "Miss_Peeled",
    "version": "2.14",
    "class": "Assassin",
    "level": 150,
    "skillPoints": {
      "APF-20 'Maelstrom' MkV": 1,
      "Anathema": 1,
      "Batstrike": 1,
      "Black Wind": 1,
      "Blink": 1,
      "Continuity": 1,
      "Melee Devotion": 1,
      "Noctule": 25,
      "Paragon of Sanctity": 1,
      "Perfect Being": 20,
      "Prismatic Cloak": 15,
      "Purity": 4,
      "Queen of Blades": 2,
      "Shadow Refuge": 2,
      "Shadowrush": 6,
      "Storm Crows": 1,
      "Vampiric Strike": 5,
      "Void Gazer": 10,
      "Way of the Gryphon": 25,
      "Way of the Phoenix": 25,
      "Way of the Raven": 15
    },
    "oSkills": {
      "Disintegrate": 12,
      "Hailstorm": 20,
      "Jitan's Gate": 1,
      "Lightning Shield": 20,
      "Lightning Wall": 19,
      "Purify": 4,
      "Stormclash": 20,
      "Summon Edyrem": 1,
      "Teleport": 15,
      "Vindicate": 1,
      "Voidstar": 28,
      "Whirlwind": 14
    },
    "allSkillsBonus": 32,
    "stats": "{{life}}=12338\n{{mana}}=4457\n{{strength}}=70\n{{dexterity}}=1160\n{{vitality}}=15\n{{energy}}=15\n{{fire_resistance}}=160\n{{cold_resistance}}=207\n{{lightning_resistance}}=56\n{{poison_resistance}}=178\n{{physical_resistance}}=7\n{{magic_resistance}}=4\n{{maximum_life}}=30\n{{movement_speed}}=59\n{{hit_recovery}}=125\n{{block_speed}}=50\n{{fire_spell_damage}}=94\n{{lightning_spell_damage}}=96\n{{cold_spell_damage}}=95\n{{enemy_fire_resistance}}=43\n{{enemy_lightning_resistance}}=105\n{{enemy_cold_resistance}}=65",
    "questsCompleted": {
      "den_of_evil": {
        "normal": true,
        "nightmare": true,
        "hell": true
      },
      "radament": {
        "normal": true,
        "nightmare": true,
        "hell": true
      },
      "izual": {
        "normal": true,
        "nightmare": true,
        "hell": true
      },
      "lam_essen's_tome": {
        "normal": true,
        "nightmare": true,
        "hell": true
      },
      "golden_bird": {
        "normal": true,
        "nightmare": true,
        "hell": true
      }
    },
    "savedAt": "2026-10-09T08:03:34.000Z"
  },
  "items": [
    {
      "item": "Horazon's Focus",
      "display_name": "Horazon's Focus",
      "type": "Charm",
      "quality": "Unique",
      "code": "a68",
      "image": "invhorazon",
      "name_color": 4,
      "eth": false,
      "corrupted": false,
      "is_charm": true,
      "is_trophy": false,
      "is_class_charm": false,
      "is_rw": false,
      "is_upgraded": false,
      "has_trophy": false,
      "ilvl": 99,
      "ilvl_original": 1,
      "quantity": null,
      "compactable": false,
      "area": "character",
      "location": "Inventory",
      "slot": null,
      "storage": 1,
      "row": 7,
      "col": 0,
      "locid": 37760,
      "display_quality": "Charm",
      "description_lines": [
        [
          [
            "Horazon's Focus",
            4
          ]
        ],
        [
          [
            "Required Level: 100",
            -1
          ]
        ],
        [
          [
            "Keep in Inventory to Gain Bonus",
            -1
          ]
        ],
        [
          [
            "+4% Life stolen per Hit",
            3
          ]
        ],
        [
          [
            "-50 Defense",
            3
          ]
        ],
        [
          [
            "+24 to all Attributes",
            3
          ]
        ]
      ],
      "socketables": [],
      "mystic_orbs": [],
      "stat_ranges": {
        "#% Life stolen per Hit": [
          3,
          5
        ],
        "+# to all Attributes": [
          21,
          25
        ]
      },
      "charm_ranges": {
        "Life stolen per Hit": "3 to 5",
        "to all Attributes": "21 to 25"
      }
    },
    {
      "item": "Visions of Akarat",
      "display_name": "Visions of Akarat",
      "type": "Charm",
      "quality": "Unique",
      "code": "a57",
      "image": "akaratbook",
      "name_color": 4,
      "eth": false,
      "corrupted": false,
      "is_charm": true,
      "is_trophy": false,
      "is_class_charm": false,
      "is_rw": false,
      "is_upgraded": false,
      "has_trophy": false,
      "ilvl": 99,
      "ilvl_original": 1,
      "quantity": null,
      "compactable": false,
      "area": "character",
      "location": "Inventory",
      "slot": null,
      "storage": 1,
      "row": 7,
      "col": 1,
      "locid": 37761,
      "display_quality": "Charm",
      "description_lines": [
        [
          [
            "Visions of Akarat",
            4
          ]
        ],
        [
          [
            "Required Level: 110",
            -1
          ]
        ],
        [
          [
            "Keep in Inventory to Gain Bonus",
            -1
          ]
        ],
        [
          [
            "+208 Defense",
            3
          ]
        ],
        [
          [
            "+25 to all Attributes",
            3
          ]
        ]
      ],
      "socketables": [],
      "mystic_orbs": [],
      "stat_ranges": {
        "+# Defense": [
          201,
          250
        ],
        "+# to all Attributes": [
          21,
          25
        ]
      },
      "charm_ranges": {
        "Defense": "201 to 250",
        "to all Attributes": "21 to 25"
      }
    },
    {
      "item": "Shadow Vortex",
      "display_name": "Shadow Vortex",
      "type": "Charm",
      "quality": "Unique",
      "code": "x02",
      "image": "ccasn",
      "name_color": 4,
      "eth": false,
      "corrupted": false,
      "is_charm": true,
      "is_trophy": false,
      "is_class_charm": true,
      "is_rw": false,
      "is_upgraded": true,
      "has_trophy": false,
      "ilvl": 99,
      "ilvl_original": 1,
      "quantity": null,
      "compactable": false,
      "area": "character",
      "location": "Inventory",
      "slot": null,
      "storage": 1,
      "row": 3,
      "col": 1,
      "locid": 37249,
      "display_quality": "Charm",
      "description_lines": [
        [
          [
            "Shadow Vortex",
            4
          ]
        ],
        [
          [
            "(Assassin Challenge Item)",
            4
          ]
        ],
        [
          [
            "(Assassin Only)",
            -1
          ]
        ],
        [
          [
            "Required Level: 90",
            -1
          ]
        ],
        [
          [
            "Keep in Inventory to Gain Bonus",
            -1
          ]
        ],
        [
          [
            "Unlocks your Ennead Skill",
            2
          ]
        ],
        [
          [
            "+3 to Assassin Skill Levels",
            3
          ]
        ],
        [
          [
            "Weapon Physical Damage +50%",
            3
          ]
        ],
        [
          [
            "Physical Damage Taken Reduced by 5",
            3
          ]
        ],
        [
          [
            "+5% Chance to Avoid Damage",
            3
          ]
        ]
      ],
      "socketables": [],
      "mystic_orbs": [],
      "stat_ranges": [],
      "charm_ranges": []
    },
    {
      "item": "The Black Road",
      "display_name": "The Black Road",
      "type": "Charm",
      "quality": "Unique",
      "code": "tbr",
      "image": "invsbk3",
      "name_color": 4,
      "eth": false,
      "corrupted": false,
      "is_charm": true,
      "is_trophy": false,
      "is_class_charm": false,
      "is_rw": false,
      "is_upgraded": true,
      "has_trophy": false,
      "ilvl": 99,
      "ilvl_original": 1,
      "quantity": null,
      "compactable": false,
      "area": "character",
      "location": "Inventory",
      "slot": null,
      "storage": 1,
      "row": 4,
      "col": 2,
      "locid": 37378,
      "display_quality": "Charm",
      "description_lines": [
        [
          [
            "The Black Road",
            4
          ]
        ],
        [
          [
            "Required Level: 115",
            -1
          ]
        ],
        [
          [
            "Keep in Inventory to Gain Bonus",
            -1
          ]
        ],
        [
          [
            "Unlocks your Black Road Skill",
            2
          ]
        ],
        [
          [
            "+150 to Life",
            3
          ]
        ],
        [
          [
            "+75 to Mana",
            3
          ]
        ],
        [
          [
            "Right click to open Time Rift",
            0
          ]
        ]
      ],
      "socketables": [],
      "mystic_orbs": [],
      "stat_ranges": [],
      "charm_ranges": []
    },
    {
      "item": "Silver Seal of Ureh",
      "display_name": "Silver Seal of Ureh",
      "type": "Charm",
      "quality": "Unique",
      "code": "aq!",
      "image": "invrin",
      "name_color": 4,
      "eth": false,
      "corrupted": false,
      "is_charm": true,
      "is_trophy": false,
      "is_class_charm": false,
      "is_rw": false,
      "is_upgraded": false,
      "has_trophy": true,
      "ilvl": 99,
      "ilvl_original": 1,
      "quantity": null,
      "compactable": false,
      "area": "character",
      "location": "Inventory",
      "slot": null,
      "storage": 1,
      "row": 5,
      "col": 3,
      "locid": 37507,
      "display_quality": "Charm",
      "description_lines": [
        [
          [
            "Silver Seal of Ureh",
            4
          ]
        ],
        [
          [
            "(Assassin Only)",
            -1
          ]
        ],
        [
          [
            "Required Level: 120",
            -1
          ]
        ],
        [
          [
            "Keep in Inventory to Gain Bonus",
            -1
          ]
        ],
        [
          [
            "+1 to All Skills",